{
  "$schema": "https://json-schema.org/draft/2020-12/schema",
  "$id": "https://github.com/dhyabi2/bounded-task-spec/schema/bounded-task.schema.json",
  "title": "Bounded task",
  "description": "bounded-task-spec 1.3.0: one paid task agreed between two agents. The pinned field set is this file; its spec_hash is sha256 of its canonical JSON (see SPEC.md).",
  "type": "object",
  "additionalProperties": false,
  "required": [
    "spec_version",
    "spec_hash",
    "task_id",
    "named_task",
    "deliverable",
    "acceptance",
    "price",
    "deadline",
    "settlement",
    "what_it_buys"
  ],
  "properties": {
    "spec_version": {
      "description": "Version of this spec the task was written against.",
      "const": "1.3.0"
    },
    "spec_hash": {
      "description": "sha256 (lowercase hex) of the canonical JSON of this schema file. Both sides evaluate the same pinned field set.",
      "type": "string",
      "pattern": "^[0-9a-f]{64}$"
    },
    "task_id": {
      "description": "Identifier chosen by the buyer. Unique per buyer. Changing any field of the task means a new task_id.",
      "type": "string",
      "pattern": "^[A-Za-z0-9._:-]{1,128}$"
    },
    "named_task": {
      "description": "Imperative name of the work. Contains no price.",
      "type": "string",
      "minLength": 1,
      "maxLength": 200
    },
    "deliverable": {
      "description": "The artifact that ends the task: what the buyer receives.",
      "type": "string",
      "minLength": 1,
      "maxLength": 2000
    },
    "acceptance": {
      "description": "Machine-checkable acceptance test. No human judgment.",
      "type": "object",
      "additionalProperties": false,
      "required": ["track", "checks"],
      "properties": {
        "track": {
          "description": "manifest: the seller's HTTP 200 body is the deliverable and the checks run on it. payment: the answer is HTTP 402 or 426 and acceptance is a confirmed payment receipt.",
          "enum": ["manifest", "payment"]
        },
        "checks": {
          "description": "All must hold (logical AND). Evaluated on the deliverable (manifest track) or the payment receipt (payment track).",
          "type": "array",
          "maxItems": 64,
          "items": {
            "type": "object",
            "additionalProperties": false,
            "required": ["path", "op"],
            "properties": {
              "path": {
                "description": "Dot path into the evidence document; a numeric segment indexes a list.",
                "type": "string",
                "pattern": "^[A-Za-z0-9_-]+(\\.[A-Za-z0-9_-]+)*$"
              },
              "op": {
                "enum": ["eq", "ne", "gt", "gte", "lt", "lte", "exists", "in"]
              },
              "value": {
                "description": "Required for every op except exists. A list for in. Integers, strings, booleans or null; never floats."
              }
            }
          }
        }
      }
    },
    "price": {
      "description": "The most the buyer will pay for this task, in total across all calls.",
      "type": "object",
      "additionalProperties": false,
      "required": ["asset", "decimals", "amount"],
      "properties": {
        "asset": {
          "description": "Ticker of what is paid, e.g. XNO or USDC.",
          "type": "string",
          "pattern": "^[A-Z0-9]{2,12}$"
        },
        "decimals": {
          "description": "Decimal places between the smallest unit and one whole unit (XNO 30, USDC 6).",
          "type": "integer",
          "minimum": 0,
          "maximum": 36
        },
        "amount": {
          "description": "Cap in the asset's smallest unit, as a base-10 integer string. Never a float.",
          "type": "string",
          "pattern": "^[1-9][0-9]{0,77}$"
        }
      }
    },
    "deadline": {
      "description": "UTC instant after which the task can no longer be accepted.",
      "type": "string",
      "pattern": "^[0-9]{4}-[0-9]{2}-[0-9]{2}T[0-9]{2}:[0-9]{2}:[0-9]{2}Z$"
    },
    "settlement": {
      "description": "Where and how the seller is paid. Rail-neutral.",
      "type": "object",
      "additionalProperties": false,
      "required": ["rail", "pay_to"],
      "properties": {
        "rail": {
          "description": "Settlement network, lowercase, e.g. nano, x402-evm, lightning.",
          "type": "string",
          "pattern": "^[a-z0-9][a-z0-9._-]{0,31}$"
        },
        "pay_to": {
          "description": "The seller's receiving address or account on that rail.",
          "type": "string",
          "minLength": 1,
          "maxLength": 256
        },
        "endpoint": {
          "description": "Optional https URL of the seller's payment or discovery endpoint.",
          "type": "string",
          "pattern": "^https://[^\\s]{1,2040}$"
        }
      }
    },
    "what_it_buys": {
      "description": "What the spend buys the buyer: the rights, quantity and duration it pays for. Plain words.",
      "type": "string",
      "minLength": 1,
      "maxLength": 1000
    },
    "parties": {
      "description": "Optional identifiers of the two agents.",
      "type": "object",
      "additionalProperties": false,
      "properties": {
        "buyer": {"type": "string", "minLength": 1, "maxLength": 256},
        "seller": {"type": "string", "minLength": 1, "maxLength": 256}
      }
    },
    "note": {
      "description": "Optional free text. Not part of acceptance.",
      "type": "string",
      "maxLength": 2000
    }
  }
}
