{
  "spec_version": "1.3.0",
  "spec_hash": "bfca60bb1e7e02ef9c107827104b22a5f77fe6cdb26fcd9cf5a03aacee3cebfe",
  "task_id": "example-payment-001",
  "named_task": "Unlock one paid API call",
  "deliverable": "One successful response from https://seller.example/api/v1/extract after the 402 is paid",
  "acceptance": {
    "track": "payment",
    "checks": [
      {"path": "tx_id", "op": "exists"}
    ]
  },
  "price": {"asset": "USDC", "decimals": 6, "amount": "10000"},
  "deadline": "2026-12-31T23:59:59Z",
  "settlement": {
    "rail": "x402-evm",
    "pay_to": "0xEXAMPLE_PLACEHOLDER_NOT_A_REAL_ADDRESS"
  },
  "what_it_buys": "A single call to the extract endpoint; no subscription, no retries beyond the one call."
}
